{
  "$schema": "https://json-schema.org/draft/2020-12/schema",
  "title": "SkillHub Agent Profile",
  "type": "object",
  "additionalProperties": false,
  "required": ["profile_version", "research_date", "official_references", "brand", "clients"],
  "properties": {
    "profile_version": {"type": "integer", "minimum": 1},
    "research_date": {"type": "string", "format": "date"},
    "official_references": {"type": "array", "minItems": 1, "items": {"type": "string", "format": "uri"}},
    "brand": {"type": "string", "minLength": 1},
    "clients": {"type": "array", "minItems": 1, "items": {"$ref": "#/$defs/client"}}
  },
  "$defs": {
    "client": {
      "type": "object", "additionalProperties": false,
      "required": ["id", "kind", "display_name", "supported_os", "path_candidates", "skill_marker", "deployment", "call_policy"],
      "properties": {
        "id": {"type": "string", "minLength": 1},
        "kind": {"enum": ["cli", "desktop", "ide_extension", "tui", "headless", "acp", "web", "mobile", "bot", "shared_directory"]},
        "display_name": {"type": "string", "minLength": 1},
        "supported_os": {"type": "array", "minItems": 1, "items": {"enum": ["windows", "macos"]}},
        "path_candidates": {"type": "array", "items": {"$ref": "#/$defs/path"}},
        "skill_marker": {"type": "string", "minLength": 1},
        "deployment": {"$ref": "#/$defs/deployment"},
        "call_policy": {"enum": ["automatic", "user_selected", "unknown"]}
      }
    },
    "path": {
      "type": "object", "additionalProperties": false,
      "required": ["path", "scope", "precedence", "marker"],
      "properties": {
        "path": {"type": "string", "minLength": 1, "description": "Supports one anchored {agent_directory} component for direct, non-hidden Agent child discovery; recursive globs are not supported."},
        "agent_root": {"type": "string", "minLength": 1, "description": "May use the same bounded {agent_directory} component as its path candidate."},
        "scope": {"enum": ["global", "project", "extra"]},
        "precedence": {"enum": ["preferred", "lower_priority_copy", "may_coexist", "unknown"]},
        "marker": {"type": "string", "minLength": 1},
        "shared_reference": {"type": "boolean"},
        "builtin": {"type": "boolean"}
      }
    },
    "deployment": {
      "type": "object", "additionalProperties": false,
      "required": ["copy", "symlink", "junction"],
      "properties": {
        "copy": {"type": "boolean"}, "symlink": {"type": "boolean"}, "junction": {"type": "boolean"},
        "limitations": {"type": "array", "items": {"type": "string"}}
      }
    }
  }
}
