{
  "profile_version": 1,
  "research_date": "2026-09-23",
  "official_references": [
    "https://learn.chatgpt.com/docs/build-skills",
    "https://github.com/vercel-labs/skills#supported-agents"
  ],
  "brand": "OpenAI Codex",
  "clients": [
    {
      "id": "codex.cli",
      "kind": "cli",
      "display_name": "Codex CLI",
      "supported_os": [
        "windows",
        "macos"
      ],
      "path_candidates": [
        {
          "path": "{project_root}/.agents/skills",
          "scope": "project",
          "precedence": "preferred",
          "marker": "SKILL.md",
          "shared_reference": true
        },
        {
          "path": "{user_home}/.agents/skills",
          "scope": "global",
          "precedence": "preferred",
          "marker": "SKILL.md",
          "shared_reference": true
        }
      ],
      "skill_marker": "SKILL.md",
      "deployment": {
        "copy": true,
        "symlink": true,
        "junction": true,
        "limitations": []
      },
      "call_policy": "unknown"
    }
  ]
}
