{
  "profile_version": 1,
  "research_date": "2026-08-21",
  "official_references": [
    "https://docs.trae.cn/ide_skills",
    "https://www.trae.ai/changelog"
  ],
  "brand": "Trae",
  "clients": [
    {
      "id": "trae.code",
      "kind": "desktop",
      "display_name": "TraeCode",
      "supported_os": [
        "windows",
        "macos"
      ],
      "path_candidates": [
        {
          "path": "{user_home}/.trae-cn/skills",
          "scope": "global",
          "precedence": "preferred",
          "marker": "SKILL.md"
        },
        {
          "path": "{project_root}/.trae/skills",
          "scope": "project",
          "precedence": "preferred",
          "marker": "SKILL.md"
        },
        {
          "path": "{project_root}/.agents/skills",
          "scope": "project",
          "precedence": "lower_priority_copy",
          "marker": "SKILL.md",
          "shared_reference": true
        }
      ],
      "skill_marker": "SKILL.md",
      "deployment": {
        "copy": true,
        "symlink": false,
        "junction": false,
        "limitations": [
          "runtime_loading_unknown",
          "symlink_support_unconfirmed",
          "junction_support_unconfirmed"
        ]
      },
      "call_policy": "unknown"
    },
    {
      "id": "trae.work",
      "kind": "desktop",
      "display_name": "TraeWork",
      "supported_os": [
        "windows",
        "macos"
      ],
      "path_candidates": [],
      "skill_marker": "SKILL.md",
      "deployment": {
        "copy": false,
        "symlink": false,
        "junction": false,
        "limitations": [
          "no_stable_public_local_skill_directory"
        ]
      },
      "call_policy": "unknown"
    }
  ]
}
