{
  "profile_version": 1,
  "research_date": "2026-09-23",
  "official_references": [
    "https://prod.cursor.com/docs/skills",
    "https://docs.cursor.com/en/cli/overview",
    "https://github.com/vercel-labs/skills#supported-agents"
  ],
  "brand": "Cursor",
  "clients": [
    {
      "id": "cursor.editor",
      "kind": "desktop",
      "display_name": "Cursor",
      "supported_os": [
        "windows",
        "macos"
      ],
      "path_candidates": [
        {
          "path": "{user_home}/.cursor/skills",
          "scope": "global",
          "precedence": "preferred",
          "marker": "SKILL.md"
        },
        {
          "path": "{user_home}/.cursor/skills-cursor",
          "scope": "global",
          "precedence": "may_coexist",
          "marker": "SKILL.md",
          "builtin": true
        },
        {
          "path": "{user_home}/.agents/skills",
          "scope": "global",
          "precedence": "lower_priority_copy",
          "marker": "SKILL.md",
          "shared_reference": true
        },
        {
          "path": "{project_root}/.cursor/skills",
          "scope": "project",
          "precedence": "preferred",
          "marker": "SKILL.md"
        },
        {
          "path": "{project_root}/.agents/skills",
          "scope": "project",
          "precedence": "lower_priority_copy",
          "marker": "SKILL.md",
          "shared_reference": true
        },
        {
          "path": "{project_root}/.claude/skills",
          "scope": "project",
          "precedence": "may_coexist",
          "marker": "SKILL.md"
        }
      ],
      "skill_marker": "SKILL.md",
      "deployment": {
        "copy": true,
        "symlink": true,
        "junction": false,
        "limitations": [
          "junction_support_unconfirmed"
        ]
      },
      "call_policy": "unknown"
    },
    {
      "id": "cursor.cli",
      "kind": "cli",
      "display_name": "Cursor CLI",
      "supported_os": [
        "windows",
        "macos"
      ],
      "path_candidates": [
        {
          "path": "{user_home}/.cursor/skills",
          "scope": "global",
          "precedence": "preferred",
          "marker": "SKILL.md"
        },
        {
          "path": "{project_root}/.cursor/skills",
          "scope": "project",
          "precedence": "preferred",
          "marker": "SKILL.md"
        },
        {
          "path": "{project_root}/.claude/skills",
          "scope": "project",
          "precedence": "may_coexist",
          "marker": "SKILL.md"
        }
      ],
      "skill_marker": "SKILL.md",
      "deployment": {
        "copy": true,
        "symlink": true,
        "junction": false,
        "limitations": [
          "junction_support_unconfirmed"
        ]
      },
      "call_policy": "unknown"
    }
  ]
}
