{
  "profile_version": 1,
  "research_date": "2026-09-23",
  "official_references": [
    "https://github.com/google-gemini/gemini-cli/blob/main/docs/cli/using-agent-skills.md",
    "https://antigravity.google/docs/skills",
    "https://github.com/vercel-labs/skills#supported-agents"
  ],
  "brand": "Google",
  "clients": [
    {
      "id": "google.gemini-cli",
      "kind": "cli",
      "display_name": "Gemini CLI",
      "supported_os": [
        "windows",
        "macos"
      ],
      "path_candidates": [
        {
          "path": "{user_home}/.gemini/skills",
          "scope": "global",
          "precedence": "preferred",
          "marker": "SKILL.md"
        },
        {
          "path": "{user_home}/.agents/skills",
          "scope": "global",
          "precedence": "lower_priority_copy",
          "marker": "SKILL.md",
          "shared_reference": true
        },
        {
          "path": "{project_root}/.gemini/skills",
          "scope": "project",
          "precedence": "preferred",
          "marker": "SKILL.md"
        },
        {
          "path": "{project_root}/.agents/skills",
          "scope": "project",
          "precedence": "lower_priority_copy",
          "marker": "SKILL.md",
          "shared_reference": true
        }
      ],
      "skill_marker": "SKILL.md",
      "deployment": {
        "copy": true,
        "symlink": true,
        "junction": false,
        "limitations": [
          "junction_support_unconfirmed"
        ]
      },
      "call_policy": "unknown"
    },
    {
      "id": "google.antigravity.app",
      "kind": "desktop",
      "display_name": "Google Antigravity",
      "supported_os": [
        "windows",
        "macos"
      ],
      "path_candidates": [
        {
          "path": "{user_home}/.gemini/config/skills",
          "scope": "global",
          "precedence": "preferred",
          "marker": "SKILL.md"
        },
        {
          "path": "{project_root}/.agents/skills",
          "scope": "project",
          "precedence": "preferred",
          "marker": "SKILL.md",
          "shared_reference": true
        },
        {
          "path": "{project_root}/.agent/skills",
          "scope": "project",
          "precedence": "may_coexist",
          "marker": "SKILL.md"
        }
      ],
      "skill_marker": "SKILL.md",
      "deployment": {
        "copy": true,
        "symlink": true,
        "junction": false,
        "limitations": [
          "junction_support_unconfirmed"
        ]
      },
      "call_policy": "unknown"
    },
    {
      "id": "google.antigravity.cli",
      "kind": "cli",
      "display_name": "Antigravity CLI",
      "supported_os": [
        "windows",
        "macos"
      ],
      "path_candidates": [
        {
          "path": "{user_home}/.gemini/config/skills",
          "scope": "global",
          "precedence": "preferred",
          "marker": "SKILL.md"
        },
        {
          "path": "{project_root}/.agents/skills",
          "scope": "project",
          "precedence": "preferred",
          "marker": "SKILL.md",
          "shared_reference": true
        },
        {
          "path": "{project_root}/.agent/skills",
          "scope": "project",
          "precedence": "may_coexist",
          "marker": "SKILL.md"
        }
      ],
      "skill_marker": "SKILL.md",
      "deployment": {
        "copy": true,
        "symlink": true,
        "junction": false,
        "limitations": [
          "junction_support_unconfirmed"
        ]
      },
      "call_policy": "unknown"
    },
    {
      "id": "google.antigravity.ide",
      "kind": "ide_extension",
      "display_name": "Antigravity IDE",
      "supported_os": [
        "windows",
        "macos"
      ],
      "path_candidates": [
        {
          "path": "{user_home}/.gemini/config/skills",
          "scope": "global",
          "precedence": "preferred",
          "marker": "SKILL.md"
        },
        {
          "path": "{project_root}/.agents/skills",
          "scope": "project",
          "precedence": "preferred",
          "marker": "SKILL.md",
          "shared_reference": true
        },
        {
          "path": "{project_root}/.agent/skills",
          "scope": "project",
          "precedence": "may_coexist",
          "marker": "SKILL.md"
        }
      ],
      "skill_marker": "SKILL.md",
      "deployment": {
        "copy": true,
        "symlink": false,
        "junction": false,
        "limitations": [
          "runtime_loading_unknown",
          "symlink_support_unconfirmed",
          "junction_support_unconfirmed"
        ]
      },
      "call_policy": "unknown"
    },
    {
      "id": "google.antigravity.sdk",
      "kind": "headless",
      "display_name": "Antigravity SDK",
      "supported_os": [
        "windows",
        "macos"
      ],
      "path_candidates": [
        {
          "path": "{user_home}/.gemini/config/skills",
          "scope": "global",
          "precedence": "preferred",
          "marker": "SKILL.md"
        },
        {
          "path": "{project_root}/.agents/skills",
          "scope": "project",
          "precedence": "preferred",
          "marker": "SKILL.md",
          "shared_reference": true
        },
        {
          "path": "{project_root}/.agent/skills",
          "scope": "project",
          "precedence": "may_coexist",
          "marker": "SKILL.md"
        }
      ],
      "skill_marker": "SKILL.md",
      "deployment": {
        "copy": true,
        "symlink": false,
        "junction": false,
        "limitations": [
          "runtime_loading_unknown",
          "symlink_support_unconfirmed",
          "junction_support_unconfirmed"
        ]
      },
      "call_policy": "unknown"
    }
  ]
}
