{
  "profile_version": 1,
  "research_date": "2026-08-21",
  "official_references": [
    "https://cloud.baidu.com/doc/COMATE/s/Nmma28iqe",
    "https://cloud.baidu.com/doc/COMATE/s/xmm4hx69k"
  ],
  "brand": "Comate",
  "clients": [
    {
      "id": "comate.ide",
      "kind": "ide_extension",
      "display_name": "文心快码 Comate",
      "supported_os": [
        "windows",
        "macos"
      ],
      "path_candidates": [
        {
          "path": "{user_home}/.comate/skills",
          "scope": "global",
          "precedence": "preferred",
          "marker": "SKILL.md"
        },
        {
          "path": "{project_root}/.comate/skills",
          "scope": "project",
          "precedence": "preferred",
          "marker": "SKILL.md"
        },
        {
          "path": "{project_root}/.agents/skills",
          "scope": "project",
          "precedence": "may_coexist",
          "marker": "SKILL.md",
          "shared_reference": true
        }
      ],
      "skill_marker": "SKILL.md",
      "deployment": {
        "copy": true,
        "symlink": false,
        "junction": false,
        "limitations": [
          "runtime_loading_unknown",
          "symlink_support_unconfirmed",
          "junction_support_unconfirmed"
        ]
      },
      "call_policy": "unknown"
    }
  ]
}
