{
  "profile_version": 1,
  "research_date": "2026-09-23",
  "official_references": [
    "https://code.claude.com/docs/en/skills",
    "https://support.claude.com/en/articles/12512198-how-to-create-custom-skills",
    "https://github.com/vercel-labs/skills#supported-agents"
  ],
  "brand": "Anthropic",
  "clients": [
    {
      "id": "anthropic.claude-code",
      "kind": "cli",
      "display_name": "Claude Code",
      "supported_os": [
        "windows",
        "macos"
      ],
      "path_candidates": [
        {
          "path": "{user_home}/.claude/skills",
          "scope": "global",
          "precedence": "preferred",
          "marker": "SKILL.md"
        },
        {
          "path": "{project_root}/.claude/skills",
          "scope": "project",
          "precedence": "preferred",
          "marker": "SKILL.md"
        }
      ],
      "skill_marker": "SKILL.md",
      "deployment": {
        "copy": true,
        "symlink": true,
        "junction": true,
        "limitations": []
      },
      "call_policy": "unknown"
    },
    {
      "id": "anthropic.claude-desktop",
      "kind": "desktop",
      "display_name": "Claude Desktop",
      "supported_os": [
        "windows",
        "macos"
      ],
      "path_candidates": [],
      "skill_marker": "SKILL.md",
      "deployment": {
        "copy": false,
        "symlink": false,
        "junction": false,
        "limitations": [
          "no_stable_public_local_skill_directory"
        ]
      },
      "call_policy": "unknown"
    }
  ]
}
