{
  "profile_version": 1,
  "research_date": "2026-10-15",
  "official_references": [
    "https://deepseek.com/harness/en/",
    "https://github.com/deepseek-ai/deepseek-harness",
    "https://github.com/deepseek-ai/deepseek-harness/blob/master/docs/subsystems/skills.md",
    "https://github.com/deepseek-ai/deepseek-harness/blob/master/apps/desktop/README.md"
  ],
  "brand": "DeepSeek Harness",
  "clients": [
    {
      "id": "deepseek-harness.tui",
      "kind": "tui",
      "display_name": "DeepSeek Harness TUI",
      "supported_os": [
        "windows",
        "macos"
      ],
      "path_candidates": [
        {
          "path": "{project_root}/.dsh/skills",
          "agent_root": "{project_root}/.dsh",
          "scope": "project",
          "precedence": "preferred",
          "marker": "SKILL.md"
        },
        {
          "path": "{project_root}/.agents/skills",
          "agent_root": "{project_root}/.dsh",
          "scope": "project",
          "precedence": "lower_priority_copy",
          "marker": "SKILL.md",
          "shared_reference": true
        },
        {
          "path": "{user_home}/.dsh/skills",
          "agent_root": "{user_home}/.dsh",
          "scope": "global",
          "precedence": "preferred",
          "marker": "SKILL.md"
        },
        {
          "path": "{user_home}/.agents/skills",
          "agent_root": "{user_home}/.dsh",
          "scope": "global",
          "precedence": "lower_priority_copy",
          "marker": "SKILL.md",
          "shared_reference": true
        }
      ],
      "skill_marker": "SKILL.md",
      "deployment": {
        "copy": true,
        "symlink": false,
        "junction": false,
        "limitations": [
          "flat_markdown_not_scanned",
          "project_ancestor_search_not_scanned",
          "runtime_loading_unknown",
          "symlink_support_unconfirmed",
          "junction_support_unconfirmed"
        ]
      },
      "call_policy": "unknown"
    },
    {
      "id": "deepseek-harness.web",
      "kind": "web",
      "display_name": "DeepSeek Harness Web",
      "supported_os": [
        "windows",
        "macos"
      ],
      "path_candidates": [
        {
          "path": "{project_root}/.dsh/skills",
          "agent_root": "{project_root}/.dsh",
          "scope": "project",
          "precedence": "preferred",
          "marker": "SKILL.md"
        },
        {
          "path": "{project_root}/.agents/skills",
          "agent_root": "{project_root}/.dsh",
          "scope": "project",
          "precedence": "lower_priority_copy",
          "marker": "SKILL.md",
          "shared_reference": true
        },
        {
          "path": "{user_home}/.dsh/skills",
          "agent_root": "{user_home}/.dsh",
          "scope": "global",
          "precedence": "preferred",
          "marker": "SKILL.md"
        },
        {
          "path": "{user_home}/.agents/skills",
          "agent_root": "{user_home}/.dsh",
          "scope": "global",
          "precedence": "lower_priority_copy",
          "marker": "SKILL.md",
          "shared_reference": true
        }
      ],
      "skill_marker": "SKILL.md",
      "deployment": {
        "copy": true,
        "symlink": false,
        "junction": false,
        "limitations": [
          "flat_markdown_not_scanned",
          "project_ancestor_search_not_scanned",
          "runtime_loading_unknown",
          "symlink_support_unconfirmed",
          "junction_support_unconfirmed"
        ]
      },
      "call_policy": "unknown"
    },
    {
      "id": "deepseek-harness.desktop",
      "kind": "desktop",
      "display_name": "DeepSeek Harness Desktop",
      "supported_os": [
        "windows",
        "macos"
      ],
      "path_candidates": [
        {
          "path": "{project_root}/.dsh/skills",
          "agent_root": "{project_root}/.dsh",
          "scope": "project",
          "precedence": "preferred",
          "marker": "SKILL.md"
        },
        {
          "path": "{project_root}/.agents/skills",
          "agent_root": "{project_root}/.dsh",
          "scope": "project",
          "precedence": "lower_priority_copy",
          "marker": "SKILL.md",
          "shared_reference": true
        },
        {
          "path": "{user_home}/.dsh/skills",
          "agent_root": "{user_home}/.dsh",
          "scope": "global",
          "precedence": "preferred",
          "marker": "SKILL.md"
        },
        {
          "path": "{user_home}/.agents/skills",
          "agent_root": "{user_home}/.dsh",
          "scope": "global",
          "precedence": "lower_priority_copy",
          "marker": "SKILL.md",
          "shared_reference": true
        }
      ],
      "skill_marker": "SKILL.md",
      "deployment": {
        "copy": true,
        "symlink": false,
        "junction": false,
        "limitations": [
          "flat_markdown_not_scanned",
          "project_ancestor_search_not_scanned",
          "runtime_loading_unknown",
          "symlink_support_unconfirmed",
          "junction_support_unconfirmed"
        ]
      },
      "call_policy": "unknown"
    }
  ]
}
