{
  "profile_version": 1,
  "research_date": "2026-09-23",
  "official_references": [
    "https://pi.dev/docs/latest/skills",
    "https://pi.dev/docs/latest/settings",
    "https://github.com/badlogic/pi-mono/tree/main/packages/coding-agent",
    "https://github.com/vercel-labs/skills#supported-agents"
  ],
  "brand": "Pi",
  "clients": [
    {
      "id": "pi.coding-agent",
      "kind": "cli",
      "display_name": "Pi coding agent",
      "supported_os": [
        "windows",
        "macos"
      ],
      "path_candidates": [
        {
          "path": "{user_home}/.pi/agent/skills",
          "scope": "global",
          "precedence": "preferred",
          "marker": "SKILL.md"
        },
        {
          "path": "{user_home}/.agents/skills",
          "scope": "global",
          "precedence": "lower_priority_copy",
          "marker": "SKILL.md",
          "shared_reference": true
        },
        {
          "path": "{project_root}/.pi/skills",
          "scope": "project",
          "precedence": "preferred",
          "marker": "SKILL.md"
        },
        {
          "path": "{project_root}/.agents/skills",
          "scope": "project",
          "precedence": "lower_priority_copy",
          "marker": "SKILL.md",
          "shared_reference": true
        }
      ],
      "skill_marker": "SKILL.md",
      "deployment": {
        "copy": true,
        "symlink": true,
        "junction": false,
        "limitations": [
          "root_level_markdown_not_scanned",
          "project_ancestor_search_not_scanned",
          "junction_support_unconfirmed"
        ]
      },
      "call_policy": "unknown"
    }
  ]
}
