{
  "profile_version": 1,
  "research_date": "2026-09-15",
  "official_references": [
    "https://agentskills.io/client-implementation/adding-skills-support",
    "https://agentskills.io/specification"
  ],
  "brand": "Agent Skills",
  "clients": [
    {
      "id": "agent-skills.shared-directory",
      "kind": "shared_directory",
      "display_name": "Agent Skills",
      "supported_os": [
        "windows",
        "macos"
      ],
      "path_candidates": [
        {
          "path": "{user_home}/.agents/skills",
          "scope": "global",
          "precedence": "preferred",
          "marker": "SKILL.md"
        },
        {
          "path": "{project_root}/.agents/skills",
          "scope": "project",
          "precedence": "preferred",
          "marker": "SKILL.md"
        }
      ],
      "skill_marker": "SKILL.md",
      "deployment": {
        "copy": true,
        "symlink": false,
        "junction": false,
        "limitations": [
          "runtime_loading_unknown",
          "symlink_support_unconfirmed",
          "junction_support_unconfirmed"
        ]
      },
      "call_policy": "unknown"
    }
  ]
}
