{
  "profile_version": 1,
  "research_date": "2026-09-23",
  "official_references": [
    "https://opencode.ai/v2/docs/skills",
    "https://opencode.ai/v2/docs/api/skill/v2-skill-list",
    "https://github.com/vercel-labs/skills#supported-agents"
  ],
  "brand": "OpenCode",
  "clients": [
    {
      "id": "opencode.cli",
      "kind": "cli",
      "display_name": "OpenCode",
      "supported_os": [
        "windows",
        "macos"
      ],
      "path_candidates": [
        {
          "path": "{user_home}/.config/opencode/skills",
          "scope": "global",
          "precedence": "preferred",
          "marker": "SKILL.md"
        },
        {
          "path": "{project_root}/.opencode/skills",
          "scope": "project",
          "precedence": "preferred",
          "marker": "SKILL.md"
        },
        {
          "path": "{project_root}/.claude/skills",
          "scope": "project",
          "precedence": "may_coexist",
          "marker": "SKILL.md"
        },
        {
          "path": "{project_root}/.agents/skills",
          "scope": "project",
          "precedence": "may_coexist",
          "marker": "SKILL.md",
          "shared_reference": true
        }
      ],
      "skill_marker": "SKILL.md",
      "deployment": {
        "copy": true,
        "symlink": true,
        "junction": false,
        "limitations": [
          "junction_support_unconfirmed"
        ]
      },
      "call_policy": "unknown"
    }
  ]
}
