{
  "profile_version": 1,
  "research_date": "2026-08-21",
  "official_references": [
    "https://docs.windsurf.com/zh/windsurf/cascade/skills"
  ],
  "brand": "Windsurf",
  "clients": [
    {
      "id": "windsurf.cascade",
      "kind": "desktop",
      "display_name": "Windsurf Cascade",
      "supported_os": [
        "windows",
        "macos"
      ],
      "path_candidates": [
        {
          "path": "{user_home}/.codeium/windsurf/skills",
          "scope": "global",
          "precedence": "preferred",
          "marker": "SKILL.md"
        },
        {
          "path": "{project_root}/.windsurf/skills",
          "scope": "project",
          "precedence": "preferred",
          "marker": "SKILL.md"
        }
      ],
      "skill_marker": "SKILL.md",
      "deployment": {
        "copy": true,
        "symlink": false,
        "junction": false,
        "limitations": [
          "runtime_loading_unknown",
          "symlink_support_unconfirmed",
          "junction_support_unconfirmed"
        ]
      },
      "call_policy": "unknown"
    }
  ]
}
