{
  "profile_version": 1,
  "research_date": "2026-08-21",
  "official_references": [
    "https://www.codebuddy.ai/docs/cli/skills",
    "https://www.codebuddy.cn/docs/cli/plugins-reference",
    "https://www.codebuddy.cn/docs/workbuddy/From-Beginner-to-Expert-Guide/Function-Description/Skills-Market"
  ],
  "brand": "CodeBuddy",
  "clients": [
    {
      "id": "codebuddy.code",
      "kind": "cli",
      "display_name": "CodeBuddy Code",
      "supported_os": [
        "windows",
        "macos"
      ],
      "path_candidates": [
        {
          "path": "{user_home}/.codebuddy/skills",
          "scope": "global",
          "precedence": "preferred",
          "marker": "SKILL.md"
        },
        {
          "path": "{project_root}/.codebuddy/skills",
          "scope": "project",
          "precedence": "preferred",
          "marker": "SKILL.md"
        }
      ],
      "skill_marker": "SKILL.md",
      "deployment": {
        "copy": true,
        "symlink": false,
        "junction": false,
        "limitations": [
          "runtime_loading_unknown",
          "symlink_support_unconfirmed",
          "junction_support_unconfirmed"
        ]
      },
      "call_policy": "unknown"
    },
    {
      "id": "codebuddy.workbuddy",
      "kind": "desktop",
      "display_name": "WorkBuddy",
      "supported_os": [
        "windows",
        "macos"
      ],
      "path_candidates": [
        {
          "path": "{user_home}/.workbuddy/skills",
          "scope": "global",
          "precedence": "preferred",
          "marker": "SKILL.md"
        },
        {
          "path": "{project_root}/.workbuddy/skills",
          "scope": "project",
          "precedence": "preferred",
          "marker": "SKILL.md"
        }
      ],
      "skill_marker": "SKILL.md",
      "deployment": {
        "copy": true,
        "symlink": false,
        "junction": false,
        "limitations": [
          "runtime_loading_unknown",
          "symlink_support_unconfirmed",
          "junction_support_unconfirmed"
        ]
      },
      "call_policy": "unknown"
    }
  ]
}
