{
  "profile_version": 1,
  "research_date": "2026-09-26",
  "official_references": [
    "https://www.kimi.com/code/docs/kimi-code-cli/customization/skills.html",
    "https://www.kimi.com/en/help/features/use-skills-in-code",
    "https://github.com/vercel-labs/skills#supported-agents"
  ],
  "brand": "Kimi",
  "clients": [
    {
      "id": "kimi.code",
      "kind": "cli",
      "display_name": "Kimi Code",
      "supported_os": [
        "windows",
        "macos"
      ],
      "path_candidates": [
        {
          "path": "{user_home}/.kimi-code/skills",
          "scope": "global",
          "precedence": "preferred",
          "marker": "SKILL.md"
        },
        {
          "path": "{user_home}/.agents/skills",
          "scope": "global",
          "precedence": "lower_priority_copy",
          "marker": "SKILL.md",
          "shared_reference": true
        },
        {
          "path": "{project_root}/.kimi-code/skills",
          "scope": "project",
          "precedence": "preferred",
          "marker": "SKILL.md"
        },
        {
          "path": "{project_root}/.agents/skills",
          "scope": "project",
          "precedence": "lower_priority_copy",
          "marker": "SKILL.md",
          "shared_reference": true
        }
      ],
      "skill_marker": "SKILL.md",
      "deployment": {
        "copy": true,
        "symlink": true,
        "junction": true,
        "limitations": []
      },
      "call_policy": "unknown"
    },
    {
      "id": "kimi.work",
      "kind": "desktop",
      "display_name": "Kimi Work",
      "supported_os": [
        "windows",
        "macos"
      ],
      "path_candidates": [],
      "skill_marker": "SKILL.md",
      "deployment": {
        "copy": false,
        "symlink": false,
        "junction": false,
        "limitations": [
          "no_stable_public_local_skill_directory"
        ]
      },
      "call_policy": "unknown"
    }
  ]
}
