{
  "profile_version": 1,
  "research_date": "2026-08-21",
  "official_references": [
    "https://docs.x.ai/build/features/skills-plugins-marketplaces",
    "https://docs.x.ai/build/cli/reference"
  ],
  "brand": "Grok",
  "clients": [
    {
      "id": "grok.build-cli",
      "kind": "cli",
      "display_name": "Grok Build CLI",
      "supported_os": [
        "windows",
        "macos"
      ],
      "path_candidates": [
        {
          "path": "{user_home}/.grok/skills",
          "scope": "global",
          "precedence": "preferred",
          "marker": "SKILL.md"
        },
        {
          "path": "{user_home}/.agents/skills",
          "scope": "global",
          "precedence": "lower_priority_copy",
          "marker": "SKILL.md",
          "shared_reference": true
        },
        {
          "path": "{project_root}/.grok/skills",
          "scope": "project",
          "precedence": "preferred",
          "marker": "SKILL.md"
        },
        {
          "path": "{project_root}/.agents/skills",
          "scope": "project",
          "precedence": "lower_priority_copy",
          "marker": "SKILL.md",
          "shared_reference": true
        }
      ],
      "skill_marker": "SKILL.md",
      "deployment": {
        "copy": true,
        "symlink": false,
        "junction": false,
        "limitations": [
          "runtime_loading_unknown",
          "symlink_support_unconfirmed",
          "junction_support_unconfirmed"
        ]
      },
      "call_policy": "unknown"
    },
    {
      "id": "grok.build-tui",
      "kind": "tui",
      "display_name": "Grok Build TUI",
      "supported_os": [
        "windows",
        "macos"
      ],
      "path_candidates": [
        {
          "path": "{user_home}/.grok/skills",
          "scope": "global",
          "precedence": "preferred",
          "marker": "SKILL.md"
        },
        {
          "path": "{project_root}/.grok/skills",
          "scope": "project",
          "precedence": "preferred",
          "marker": "SKILL.md"
        },
        {
          "path": "{user_home}/.agents/skills",
          "scope": "global",
          "precedence": "lower_priority_copy",
          "marker": "SKILL.md",
          "shared_reference": true
        },
        {
          "path": "{project_root}/.agents/skills",
          "scope": "project",
          "precedence": "lower_priority_copy",
          "marker": "SKILL.md",
          "shared_reference": true
        }
      ],
      "skill_marker": "SKILL.md",
      "deployment": {
        "copy": true,
        "symlink": false,
        "junction": false,
        "limitations": [
          "runtime_loading_unknown",
          "symlink_support_unconfirmed",
          "junction_support_unconfirmed"
        ]
      },
      "call_policy": "unknown"
    },
    {
      "id": "grok.build-acp",
      "kind": "acp",
      "display_name": "Grok Build ACP",
      "supported_os": [
        "windows",
        "macos"
      ],
      "path_candidates": [
        {
          "path": "{user_home}/.grok/skills",
          "scope": "global",
          "precedence": "preferred",
          "marker": "SKILL.md"
        },
        {
          "path": "{project_root}/.grok/skills",
          "scope": "project",
          "precedence": "preferred",
          "marker": "SKILL.md"
        },
        {
          "path": "{user_home}/.agents/skills",
          "scope": "global",
          "precedence": "lower_priority_copy",
          "marker": "SKILL.md",
          "shared_reference": true
        },
        {
          "path": "{project_root}/.agents/skills",
          "scope": "project",
          "precedence": "lower_priority_copy",
          "marker": "SKILL.md",
          "shared_reference": true
        }
      ],
      "skill_marker": "SKILL.md",
      "deployment": {
        "copy": true,
        "symlink": false,
        "junction": false,
        "limitations": [
          "runtime_loading_unknown",
          "symlink_support_unconfirmed",
          "junction_support_unconfirmed"
        ]
      },
      "call_policy": "unknown"
    },
    {
      "id": "grok.consumer",
      "kind": "web",
      "display_name": "Grok",
      "supported_os": [
        "windows",
        "macos"
      ],
      "path_candidates": [],
      "skill_marker": "SKILL.md",
      "deployment": {
        "copy": false,
        "symlink": false,
        "junction": false,
        "limitations": [
          "no_stable_public_local_skill_directory"
        ]
      },
      "call_policy": "unknown"
    },
    {
      "id": "grok.bot",
      "kind": "bot",
      "display_name": "Grok Bot",
      "supported_os": [
        "windows",
        "macos"
      ],
      "path_candidates": [],
      "skill_marker": "SKILL.md",
      "deployment": {
        "copy": false,
        "symlink": false,
        "junction": false,
        "limitations": [
          "no_stable_public_local_skill_directory"
        ]
      },
      "call_policy": "unknown"
    }
  ]
}
