{
  "profile_version": 1,
  "research_date": "2026-08-21",
  "official_references": [
    "https://learn.chatgpt.com/docs/build-skills",
    "https://github.com/openai/codex"
  ],
  "brand": "OpenAI",
  "clients": [
    {
      "id": "openai.codex-cli",
      "kind": "cli",
      "display_name": "Codex CLI",
      "supported_os": [
        "windows",
        "macos"
      ],
      "path_candidates": [
        {
          "path": "{user_home}/.agents/skills",
          "scope": "global",
          "precedence": "preferred",
          "marker": "SKILL.md",
          "shared_reference": true
        },
        {
          "path": "{project_root}/.agents/skills",
          "scope": "project",
          "precedence": "preferred",
          "marker": "SKILL.md",
          "shared_reference": true
        }
      ],
      "skill_marker": "SKILL.md",
      "deployment": {
        "copy": true,
        "symlink": true,
        "junction": true,
        "limitations": [
          "runtime_loading_unknown"
        ]
      },
      "call_policy": "unknown"
    },
    {
      "id": "openai.codex-ide",
      "kind": "ide_extension",
      "display_name": "Codex IDE extension",
      "supported_os": [
        "windows",
        "macos"
      ],
      "path_candidates": [
        {
          "path": "{user_home}/.agents/skills",
          "scope": "global",
          "precedence": "preferred",
          "marker": "SKILL.md",
          "shared_reference": true
        },
        {
          "path": "{project_root}/.agents/skills",
          "scope": "project",
          "precedence": "preferred",
          "marker": "SKILL.md",
          "shared_reference": true
        }
      ],
      "skill_marker": "SKILL.md",
      "deployment": {
        "copy": true,
        "symlink": true,
        "junction": true,
        "limitations": [
          "runtime_loading_unknown"
        ]
      },
      "call_policy": "unknown"
    },
    {
      "id": "openai.chatgpt-desktop",
      "kind": "desktop",
      "display_name": "ChatGPT Desktop",
      "supported_os": [
        "windows",
        "macos"
      ],
      "path_candidates": [],
      "skill_marker": "SKILL.md",
      "deployment": {
        "copy": false,
        "symlink": false,
        "junction": false,
        "limitations": [
          "no_stable_public_local_skill_directory"
        ]
      },
      "call_policy": "unknown"
    }
  ]
}
