{
  "profile_version": 1,
  "research_date": "2026-09-26",
  "official_references": [
    "https://docs.github.com/en/copilot/concepts/agents/about-agent-skills",
    "https://docs.github.com/en/copilot/how-tos/copilot-cli/customize-copilot/add-skills",
    "https://github.com/vercel-labs/skills#supported-agents"
  ],
  "brand": "GitHub Copilot",
  "clients": [
    {
      "id": "github-copilot.cli",
      "kind": "cli",
      "display_name": "GitHub Copilot CLI",
      "supported_os": [
        "windows",
        "macos"
      ],
      "path_candidates": [
        {
          "path": "{user_home}/.copilot/skills",
          "scope": "global",
          "precedence": "preferred",
          "marker": "SKILL.md"
        },
        {
          "path": "{user_home}/.agents/skills",
          "scope": "global",
          "precedence": "lower_priority_copy",
          "marker": "SKILL.md",
          "shared_reference": true
        },
        {
          "path": "{project_root}/.github/skills",
          "scope": "project",
          "precedence": "preferred",
          "marker": "SKILL.md"
        },
        {
          "path": "{project_root}/.agents/skills",
          "scope": "project",
          "precedence": "lower_priority_copy",
          "marker": "SKILL.md",
          "shared_reference": true
        },
        {
          "path": "{project_root}/.claude/skills",
          "scope": "project",
          "precedence": "may_coexist",
          "marker": "SKILL.md"
        }
      ],
      "skill_marker": "SKILL.md",
      "deployment": {
        "copy": true,
        "symlink": true,
        "junction": true,
        "limitations": []
      },
      "call_policy": "unknown"
    },
    {
      "id": "github-copilot.ide",
      "kind": "ide_extension",
      "display_name": "GitHub Copilot",
      "supported_os": [
        "windows",
        "macos"
      ],
      "path_candidates": [
        {
          "path": "{user_home}/.copilot/skills",
          "scope": "global",
          "precedence": "preferred",
          "marker": "SKILL.md"
        },
        {
          "path": "{project_root}/.github/skills",
          "scope": "project",
          "precedence": "preferred",
          "marker": "SKILL.md"
        },
        {
          "path": "{project_root}/.claude/skills",
          "scope": "project",
          "precedence": "may_coexist",
          "marker": "SKILL.md"
        }
      ],
      "skill_marker": "SKILL.md",
      "deployment": {
        "copy": true,
        "symlink": true,
        "junction": true,
        "limitations": []
      },
      "call_policy": "unknown"
    },
    {
      "id": "github-copilot.cloud",
      "kind": "headless",
      "display_name": "GitHub Copilot coding agent",
      "supported_os": [
        "windows",
        "macos"
      ],
      "path_candidates": [],
      "skill_marker": "SKILL.md",
      "deployment": {
        "copy": false,
        "symlink": false,
        "junction": false,
        "limitations": [
          "no_stable_public_local_skill_directory"
        ]
      },
      "call_policy": "unknown"
    }
  ]
}
