{
  "profile_version": 1,
  "research_date": "2026-09-23",
  "official_references": [
    "https://help.aliyun.com/zh/lingma/qoder-cn/user-guide/skills",
    "https://help.aliyun.com/zh/lingma/plugin-hidden-release",
    "https://github.com/vercel-labs/skills#supported-agents"
  ],
  "brand": "Qoder",
  "clients": [
    {
      "id": "qoder.ide",
      "kind": "ide_extension",
      "display_name": "Qoder (Lingma)",
      "supported_os": [
        "windows",
        "macos"
      ],
      "path_candidates": [
        {
          "path": "{user_home}/.lingma/skills",
          "scope": "global",
          "precedence": "preferred",
          "marker": "SKILL.md"
        },
        {
          "path": "{project_root}/.lingma/skills",
          "scope": "project",
          "precedence": "preferred",
          "marker": "SKILL.md"
        }
      ],
      "skill_marker": "SKILL.md",
      "deployment": {
        "copy": true,
        "symlink": true,
        "junction": false,
        "limitations": [
          "junction_support_unconfirmed"
        ]
      },
      "call_policy": "unknown"
    },
    {
      "id": "qoder.cli",
      "kind": "cli",
      "display_name": "Qoder CLI",
      "supported_os": [
        "windows",
        "macos"
      ],
      "path_candidates": [
        {
          "path": "{project_root}/.qoder/skills",
          "scope": "project",
          "precedence": "preferred",
          "marker": "SKILL.md"
        }
      ],
      "skill_marker": "SKILL.md",
      "deployment": {
        "copy": true,
        "symlink": true,
        "junction": false,
        "limitations": [
          "junction_support_unconfirmed"
        ]
      },
      "call_policy": "unknown"
    }
  ]
}
