{
  "profile_version": 1,
  "research_date": "2026-09-26",
  "official_references": [
    "https://www.doubao.com/work",
    "https://www.doubao.com/download/desktop"
  ],
  "brand": "Doubao Work",
  "clients": [
    {
      "id": "doubao-work.desktop",
      "kind": "desktop",
      "display_name": "豆包工作",
      "supported_os": [
        "windows",
        "macos"
      ],
      "path_candidates": [
        {
          "path": "{user_home}/AppData/Local/DoubaoWork/User Data/Default/.doubaowork/agent_mode/workspace/.skills",
          "scope": "global",
          "precedence": "may_coexist",
          "marker": "SKILL.md",
          "builtin": true
        },
        {
          "path": "{user_home}/AppData/Local/DoubaoWork/User Data/Default/.doubaowork/agent_mode/workspace/.user_skills",
          "scope": "global",
          "precedence": "preferred",
          "marker": "SKILL.md"
        },
        {
          "path": "{project_root}/skills",
          "scope": "project",
          "precedence": "preferred",
          "marker": "SKILL.md"
        },
        {
          "path": "{user_home}/.agents/skills",
          "scope": "global",
          "precedence": "preferred",
          "marker": "SKILL.md",
          "shared_reference": true
        }
      ],
      "skill_marker": "SKILL.md",
      "deployment": {
        "copy": true,
        "symlink": false,
        "junction": false,
        "limitations": [
          "runtime_loading_unknown",
          "symlink_support_unconfirmed",
          "junction_support_unconfirmed",
          "macos_support_unconfirmed"
        ]
      },
      "call_policy": "unknown"
    }
  ]
}
