{
  "profile_version": 1,
  "research_date": "2026-08-21",
  "official_references": [
    "https://docs.openclaw.ai/skills",
    "https://github.com/openclaw/openclaw"
  ],
  "brand": "OpenClaw",
  "clients": [
    {
      "id": "openclaw.agent",
      "kind": "headless",
      "display_name": "OpenClaw",
      "supported_os": [
        "windows",
        "macos"
      ],
      "path_candidates": [
        {
          "path": "{user_home}/.agents/skills",
          "scope": "global",
          "precedence": "preferred",
          "marker": "SKILL.md",
          "shared_reference": true
        },
        {
          "path": "{user_home}/.openclaw/skills",
          "scope": "global",
          "precedence": "preferred",
          "marker": "SKILL.md"
        },
        {
          "path": "{project_root}/skills",
          "scope": "project",
          "precedence": "preferred",
          "marker": "SKILL.md"
        },
        {
          "path": "{project_root}/.agents/skills",
          "scope": "project",
          "precedence": "preferred",
          "marker": "SKILL.md",
          "shared_reference": true
        }
      ],
      "skill_marker": "SKILL.md",
      "deployment": {
        "copy": true,
        "symlink": true,
        "junction": true,
        "limitations": [
          "runtime_loading_unknown"
        ]
      },
      "call_policy": "unknown"
    }
  ]
}
