{
  "profile_version": 1,
  "research_date": "2026-08-21",
  "official_references": [
    "https://hermes-agent.nousresearch.com/docs/user-guide/features/skills",
    "https://hermes-agent.nousresearch.com/docs/guides/work-with-skills"
  ],
  "brand": "Hermes",
  "clients": [
    {
      "id": "hermes.agent",
      "kind": "cli",
      "display_name": "Hermes Agent",
      "supported_os": [
        "windows",
        "macos"
      ],
      "path_candidates": [
        {
          "path": "{user_home}/.hermes/skills",
          "scope": "global",
          "precedence": "preferred",
          "marker": "SKILL.md"
        },
        {
          "path": "{project_root}/.hermes/skills",
          "scope": "project",
          "precedence": "preferred",
          "marker": "SKILL.md"
        },
        {
          "path": "{project_root}/.agents/skills",
          "scope": "project",
          "precedence": "may_coexist",
          "marker": "SKILL.md",
          "shared_reference": true
        }
      ],
      "skill_marker": "SKILL.md",
      "deployment": {
        "copy": true,
        "symlink": false,
        "junction": false,
        "limitations": [
          "runtime_loading_unknown",
          "symlink_support_unconfirmed",
          "junction_support_unconfirmed"
        ]
      },
      "call_policy": "unknown"
    }
  ]
}
